Preposition,Sense,Role,Role relabeling,Relabeling Comments,# Train examples,# Test examples,Definition,Example,Other prepositions,Comments,Semantic Role,Attachment properties, Complement Properties,Framenet (Frame:FrameElement)
about,1(1),,Topic,,627,322,on the subject of; concerning:,I was thinking about you; a book about ancient Greece; it's all about having fun.; ,"on,over,of,with respect to,","Synonymous with over and on in many contexts, though not always interchangeable because of usage dictates. ",SubjectConsidered,"verbs and nouns of info processing, storage, or communication; adjs denoting feelings and attitudes",any NP; a subject of consideration,Awareness:Content; Awareness:Topic; Becoming_aware:Topic; Candidness:Topic; Certainty:Content; Certainty:Topic; Chatting:Topic; Cogitation:Topic; Coming_to_believe:Content; Coming_to_believe:Topic; Commitment:Topic; Communication_manner:Topic; Communication_noise:Topic; Communication_response:Topic; Contacting:Topic; Contrition:Action; Discussion:Topic; Emotion_active:Topic; Emotion_directed:Stimulus; Emotion_directed:Topic; Emotion_heat:Cause; Emotion_heat:Topic; Experiencer_subj:Content; Experiencer_subj:Topic; Expertise:Knowledge; Fairness_evaluation:Grounds; Hear:Topic; Hostile_encounter:Issue; Judgment:Reason; Judgment_communication:Evaluee; Judgment_communication:Reason; Judgment_direct_address:Reason; Judgment_direct_address:Topic; Memory:Topic; Mental_property:Practice; Partiality:Dispute; Quarreling:Issue; Questioning:Topic; Sociability:Content; Social_interaction_evaluation:Behavior; Social_interaction_evaluation:Topic; Speak_on_topic:Topic; Statement:Manner; Statement:Message; Statement:Topic; Strictness:Issue; Subject_stimulus:Stimulus; Telling:Message; Telling:Topic; Text:Topic; Volubility:Topic; 
about,2(1a),,Topic,,10,8,so as to affect:,there's nothing we can do about it.; ,"on,concerning,with respect to,","In the most general way, easily subsumed by the core sense. ",SubjectAffected,verbs of action and deliberation,any NP; sth affected by the POA,Custom:Domain; Judgment:Evaluee; Judgment_communication:Topic; Prevarication:Topic; 
about,3(2),,Location,This is hard decision. I finally settled on Location after considering Direction and ObjectOfVerb.,48,24,used to indicate movement within a particular area:,she looked about the room.; ,"around,through,","ODE: chiefly Brit. Am choice for this is nearly always ""around"" ",Area,verbs of motion and perception,a space; sth capable of being navigated or inspected,Carrying:Area; Cause_motion:Area; Cotheme:Area; Motion_noise:Area; Motion_noise:Path; Perception_active:Direction; Self_motion:Area; 
about,3(2)-1,,Location,This is hard decision. I finally settled on Location after considering Direction and ObjectOfVerb.,12,6,around,,"round (Brit),around,",See treatment. ,FocalPoint,verbs of motion and perception; other activities,a focal point in space; a focus of attention (often personal pronoun); center of a circular area,Body_movement:Goal; Cause_motion:Goal; Cause_to_move_in_place:Fixed_location; Dispersal:Goal_area; Hair_configuration:Location; Manipulation:Locus; Mass_motion:Area; Perception_active:Ground; Placing:Goal; Self_motion:Path; 
about,4(3),,Location,,1,0,used to express location in a particular place:,rugs were strewn about the hall; he produced a knife from somewhere about his person.; ,"around,in,throughout,","ODE: chiefly Brit. Am choice for this is nearly always ""around"" ",Location,verbs of location; objects that can be located in space,"a space, literal or abstract",Scrutiny:Ground; 
about,5(3a),,Possessor,"This is not an Attribute, whose definition requires the object of the preposition to be the attribute. Here the object is the owner of the attribute. This is possession in a loose sense because the subject of the preposition is a quality that is possessed by the object.",2,4,used to describe a quality apparent in a person:,there was a look about her that said everything.; ,"concerning,with respect to,","Could easily be a core sense, and closer in meaning to sense 1 than here. ODE falsely limits the comp to persons; I've expanded it, to include both ""there was a look about her that said everything"" and ""there is something absurd about that marriage."" ",AttributeOwner,an attributed quality,a person; a thing with attributes,Certainty:Cognizer; Judgment:Expressor; Mental_property:Behavior; 
,,,,,,,,,,,,,,
,,,,,,,,,,,,,,
above,1(1),,Location,,2,1,in extended space over and not touching:,a display of fireworks above the town; a cable runs above the duct.; ,"over,on top of,",more or less identical to over 1(1) ,ThingSurmounted,wide range of POSs. No pattern,a physical entity that can have sth above it,Fluidic_motion:Area; Motion_directional:Area; 
above,2(1a),,Location,,6,4,extending upwards over:,she held her arms above her head.; ,"over,on top of,",Not really different from 1(1) ,ThingSurmounted,wide range of POSs. No pattern,a physical entity that can have sth above it,Attaching:Goal; Body_movement:Goal; Change_posture:Goal; Path_shape:Area; 
above,3(1b),,Location,,0,0,higher than and to one side of; overlooking:,in the hills above the capital; on the wall above the altar.; ,over,"corresponds to over 3(1b). This sense is often implicit in the core sense, and also in sense 4(2). ",ThingSurveyed,a physical entity higher in space than the comp.,a physical entity lower in space than the POA,
above,4(2),,Location,,27,14,at a higher level or layer than:,from his flat above the corner shop; bruises above both eyes.; ,"over,on top of,",corresponds to over 1(1) and 4(2); little to choose between this and 2(1a) ,ThingSurmounted,wide range of POSs. No pattern,a physical entity that can have sth above it,Becoming_aware:Ground; Biological_area:Relative_location; Body_movement:Path; Cause_motion:Path; Location_of_light:Ground; Make_Noise:Place; Natural_features:Relative_location; Path_shape:Goal; Perception_active:Direction; Perception_experience:Direction; Placing:Goal; Posture:Location; Residence:Location; Roadways:Area; Self_motion:Area; Self_motion:Path; 
above,5(2a),,Other,,0,0,higher in grade or rank than:,at a level above the common people.; ,"over,on top of,",identical to over 5(2a) ,ThingOutranked,copula,"noun, often an agent or person.",
above,6(2b),,Other,,0,0,considered of higher status or worth than; too good for:,she married above her.; ,,"This is a sense not shared by ""over"" ",InferiorObject,copula,often gerund; otherwise personal or reflexive pronoun.,
above,7(2c),,Other,,0,3,in preference to:,the firm cynically chose profit above car safety.; ,"instead of,in place of,over,",identical to over 7(2c) ,ThingNotPreferred,the preferred of two things,the rejected of two things,Experiencer_subj:Degree; Judgment:Degree; 
above,8(2d),,Other,,5,1,at a higher volume or pitch than:,he seldom spoke above a whisper; the doorbell went unheard above the din.; ,over,Identical to over 9(2e),DrownedSound,nouns and verbs denoting sound or aural perception,the quieter of two noises or sounds,Perception_experience:Ground; 
above,9(3),,Other,,8,0,"higher than (a specified amount, rate, or norm):",the food was well above average; above sea level.; ,over,"not really different from over 10(3), even though that sense doesn't mention idea of norms.",Norm,an entity for which norms exist; verbs of location on a scale.,an established norm,Cause_motion:Goal; Cause_temperature_change:Temperature_goal; Change_position_on_a_scale:Value_2; 
,,,,,,,,,,,,,,
,,,,,,,,,,,,,,
across,1(1),,Location,,307,145,"from one side to the other of (a place, area, etc.):",I ran across the street; travelling across Europe; he had swum across.; ,through,See note in treatment.,PlaceTraversed,verbs of motion,a place; physical space that can be crossed,Body_mark:Attachment; Body_movement:Path; Carrying:Path; Cause_fluidic_motion:Goal; Cause_harm:Body_part; Cause_motion:Path; Change_posture:Path; Cotheme:Path; Departing:Path; Dispersal:Goal_area; Escaping:Path; Fluidic_motion:Goal; Fluidic_motion:Path; Giving:Place; Light_movement:Path; Location_of_light:Ground; Mass_motion:Path; Motion:Path; Motion_noise:Path; Operate_vehicle:Path; Path_shape:Area; Path_shape:Path; Perception_active:Direction; Perception_active:Ground; Perception_experience:Body_part; Perception_experience:Direction; Ride_Vehicle:Path; Self_motion:Area; Self_motion:Goal; Self_motion:Path; Travel:Area; Travel:Path; 
across,1(1)-1,,Temporal,,0,1,used to indicate a period of time begun while some activity continues,,"through,throughout,",See treatment.,PeriodTraversed,verbs of duration,nouns denoting a period of time,Process_continue:Duration; 
across,2(2),,Location,,12,5,expressing position or orientation:,"they lived across the street from one another; the bridge across the river; he looked across at me; halfway across, Jenny jumped.; ",opposite,"In many cases this sense is distinguishable by the presence of ""from"", either directly after ""across"" or in another PP following the ""across"" PP.",PositionRelation,nouns denoting physical objects; verbs of location,a place; identifiable point in space,Being_attached:Goal; Cause_motion:Goal; Change_posture:Goal; Placing:Goal; Posture:Location; Residence:Location; Roadways:Path; 
,,,,,,,,,,,,,,
,,,,,,,,,,,,,,
after,1(1),,Temporal,,37,23,in the time following (an event or another period of time):,shortly after Christmas; after a while he returned; he'd gone out with his secretary for an after-work drink.; ,following,"when complement is an event, it is often implied that it is a cause: ""he looked crestfallen after his loss.""",TimePeriod,nouns denoting events or points in time; verbs,an event; a period of time,Amalgamation:Time; Arrest:Time; Arriving:Time; Avoiding:Time; Becoming_aware:Time; Behind_the_scenes:Time; Cause_change_of_phase:Time; Cause_change_of_scalar_position:Time; Cause_harm:Time; Cause_temperature_change:Time; Change_of_consistency:Time; Change_posture:Time; Contacting:Time; Cooking_creation:Time; Criminal_investigation:Incident; Cure:Time; Departing:Time; Emitting:Time; Escaping:Time; Evading:Time; Event:Time; Excreting:Frequency; Firing:Time; Forming_relationships:Time; Getting:Manner; Killing:Killer; Memory:Time; Motion:Time; Motion_directional:Time; Process_continue:Duration; Process_end:Time; Process_stop:Time; Processing_materials:Time; Quitting:Time; Reshaping:Time; Rotting:Time; Self_motion:Time; Sleep:Time; Subject_stimulus:Circumstances; Surpassing:Time; Travel:Time; 
after,1(1)-1,,Cause,,12,7,following in time and resulting from,,"because of,on account of,from,",See treatment.,Cause,a resultant following event described in the comp.,an event causing the POA,Appearance:Inference; Biological_urge:Time; Emotion_directed:Stimulus; Fluidic_motion:Time; Predicament:Time; Quitting:Reason; Waking_up:Time; 
after,10(5a),,Other,,0,0,in imitation of:,a drawing after Millet's The Reapers.; ,,<MISSING>,TargetOfImitation,object representing an imitation; work of art,thing serving as a model for imitation,
after,2(1a),,Temporal,,0,0,in phrases indicating something happening continuously or repeatedly:,day after day we kept studying.; ,,"This sense is specific to the formula ""day after day,"" etc.",PeriodRepeated,same as comp,word denoting a period of time,
after,3(1b),,Temporal,,0,0,past (used in specifying a time):,I strolled in about ten minutes after two.; ,past,<MISSING>,ClockHour,"numbers indicating minutes; ""quarter""","numbers 1 to 12 (representing hours); noon, miday, or midnight",
after,4(1c),,Beneficiary,This is labeled as a beneficiary because of the affinity with 'for',0,0,during the time following the departure or action of:,she cooks for him and cleans up after him.; ,for,<MISSING>,Departed,action verbs,a person or abstract agent,
after,5(2),,Direction,This is a direction because the object exists only because of the verb,32,10,behind:,"she went out, shutting the door after her.; ",behind,affinity with behind core senses 1 and 2.,Front,nouns denoting objects in space; verbs of motion or location,an object located in space,Motion_noise:Path; Self_motion:Cotheme; Self_motion:Path; 
after,6(2a),,Direction,This is not a Location or direction because there is not necessarily a spatial context here.,4,5,(with reference to looking or speaking) in the direction of someone who is moving further away:,she stared after him.; ,"to,toward,",This is somewhat uncertainly defined and not found in other dictys.,TargetOfAction,verbs of speech and vision,"a person, other being, or group of these",Communication_manner:Addressee; Making_faces:Path_of_gaze; Perception_active:Direction; Questioning:Topic; 
after,7(3),,ObjectOfVerb,"Once again, there is much controversy here! Why not direction? Because direction should not include a figurative meaning.",15,4,in pursuit or quest of:,chasing after something you can't have.; ,,<MISSING>,TargetOfPursuit,verbs of pursuit; nouns denoting agents,NP denoting object of pursuit,Cause_motion:Path; Cotheme:Cotheme; Desiring:Event; Desiring:Focal_participant; Experiencer_subj:Content; 
after,8(4),,Other,,0,0,next to and following in order or importance:,in their order of priorities health comes after housing.; ,next to,<MISSING>,EntryPreceding,a later item in same set,an earlier item on a list or set of priorities,
after,9(5),,Other,,3,4,in allusion to (someone or something with the same or a related name):,"they named her Pauline, after Barbara's mother.; ",for,"""for"" is used with the same meaning in US English; ODE doesn't cover it.",TargetOfAllusion,verbs of naming,person or thing serving as inspiration for a name,Name_conferral:Motivation; Name_conferral:Name_source; Speak_on_topic:Manner; 
,,,,,,,,,,,,,,
,,,,,,,,,,,,,,
against,1(1),,Opponent/Contrast,,72,41,in opposition to:,the fight against crime; he decided against immediate publication; swimming against the tide.; ,with,<MISSING>,Opponent,"verbs (to which ""against"" introduces idea of opposition); nouns denoting conflict",a person or thing (often abstract) opposed,Emotion_directed:Stimulus; Reasoning:Content; Evidence:Proposition; Hostile_encounter:Side_2; Statement:Topic; Collaboration:Undertaking; Statement:Message; Judgment_communication:Evaluee; Coming_to_be:Entity; Emotion_active:Topic; Talking_into:Content; Change_of_leadership:Old_order; Change_of_leadership:Old_leader; Suasion:Content; Piracy:Vehicle; Killing:Victim; Experiencer_subj:Content; Revenge:Injury; Judgment:Evaluee; Awareness:Topic; Text:Topic; Attempt_suasion:Content; 
against,10(4),,PhysicalSupport,,84,40,"in or into physical contact with (something), so as to be supported by or collide with it:",she stood with her back against the door; frustration made him bang his head against the wall.; ,,<MISSING>,Backstop,sth in contact with the Comp (sometimes via collision),support or stop for a sth contacting or colliding,Body_movement:Goal; Cause_impact:Impactee; Impact:Impactee; Change_posture:Goal; Posture:Location; Reshaping:Resistant_surface; Cause_motion:Goal; Placing:Goal; Manipulation:Locus; Cause_to_fragment:Resistant_surface; Cause_fluidic_motion:Goal; 
against,2(1a),,Opponent/Contrast,,17,4,with reference to legal action:,the first victim gave evidence against him.; ,,<MISSING>,Antagonist,nouns and verbs characterizing legal conflict,disfavored side in a legal dispute,Arson:Perpetrator; Notification_of_charges:Accused; Verdict:Defendant; Verdict:Finding; 
against,3(1b),,Opponent/Contrast,,11,3,with reference to a sporting contest:,the championship match against Somerset.; ,with,<MISSING>,Contestant,nouns and verbs denoting contests,a contestant in sports or other competition,Finish_competition:Opponent; 
against,4(2),,Other,,5,0,in anticipation of and preparation for (a problem or difficulty):,he gritted his teeth against the pain; makeshift barricades against tank attacks.; ,,<MISSING>,FutureEvent,nouns and verbs denoting preparation or anticipation,anticipated adverse event,
against,5(2a),,Other,This doesn't happen at all in train/test. So it is hard to justify a different label,0,0,(in betting) in anticipation of the failure of:,the odds were 5-1 against England.; ,,<MISSING>,Nonfavorite,the word 'odds'; nouns and verbs of wagering,disfavored entity in a wager,
against,6(2b),,Opponent/Contrast,,6,4,in resistance to; as protection from:,he turned up his collar against the wind.; ,,"Differs from core sense only in noting current, as opposed to future resistance.",OpposingForce,noun or verb denoting a bulwark,sth actively resisted,Cure:Affliction; Revenge:Offender; 
against,7(2c),,Other,This doesn't happen at all in train/test. So it is hard to justify a different label,0,0,"in relation to (an amount of money owed, due, or lent) so as to reduce, cancel, or secure it:",money was advanced against the value of the property.; ,,<MISSING>,Collateral,amount of money or other denotationof value,collateral or security in a transaction,
against,8(3),,Other,This doesn't happen at all in train/test. So it is hard to justify a different label,0,0,in conceptual contrast to:,the benefits must be weighed against the costs.; ,in opposition to,<MISSING>,Downside,verbs of comparing; nouns denoting upside,downside; the con in a pro/con situation,
against,9(3a),,Other,This doesn't happen at all in train/test. So it is hard to justify a different label,0,0,in visual contrast to:,he was silhouetted against the light of the stair window.; ,,<MISSING>,Backdrop,foregrounded feature,visually distinctive background,
,,,,,,,,,,,,,,
,,,,,,,,,,,,,,
along,1(1),,Direction,,347,165,moving in a constant direction on (a more or less horizontal surface):,soon we were driving along a narrow road; he saw Gray run along the top of the wall; we continued to plod along.; ,"up,down,alongside,",<MISSING>,Path,verbs of movement; nouns of location,a pathway (mainly horizontal),Body_movement:Path; Carrying:Path; Cause_motion:Path; Cotheme:Path; Departing:Path; Dispersal:Goal_area; Fluidic_motion:Path; Friction:Static_object; Friction:Theme; Mass_motion:Area; Motion:Path; Motion_noise:Path; Operate_vehicle:Path; Path_shape:Path; Perception_active:Direction; Ride_Vehicle:Path; Self_motion:Area; Self_motion:Path; Sending:Path; Sound_movement:Path; Sounds:Ground; Travel:Area; Travel:Path; 
along,2(1a),,Other,,0,0,used to refer to the passage of time or the making of progress:,you'll pick up some valuable tips along the way; they asked how the construction was coming along.; ,through,<MISSING>,PathOfProgress,verbs,"""the way""; ""the road""; ""the line""",
along,3(2),,Location,,15,8,extending in a more or less horizontal line on:,cars were parked along the grass verge; the path along the cliff.; ,up and down,<MISSING>,LinearArrangement,nouns denoting physical objects; verbs of location,physical space with linear dimension,Accoutrements:Body_location; Amalgamation:Place; Biological_area:Relative_location; Body_movement:Goal; Hostile_encounter:Location; Ingestion:Place; Natural_features:Relative_location; Observable_bodyparts:Attachment; Perception_body:Body_part; Perception_experience:Body_part; Placing:Goal; Reshaping:Place; Residence:Location; Roadways:Path; Social_event:Place; 
along,4(3),,Manner,,2,0,in accordance with,,"in accordance with,with reference to,",new sense; see treatment.,ReferenceScale,verbs denoting judgments,"often ""lines"" with an attributive adj.",Encoding:Manner; Separation:Criterion; 
,,,,,,,,,,,,,,
,,,,,,,,,,,,,,
among,1(1),,Location,,41,15,situated more or less centrally in relation to (several other things):,flowers hidden among the roots of the trees; you're among friends.; ,"between,amidst,",Essentially identical to between 1(1) for our purposes.,SpaceBisected,nouns and verbs of motion and location,"one or more physical entities; often joined by ""and""",Cause_motion:Area; Cause_motion:Goal; Cotheme:Area; Departing:Goal; Eclipse:Obstruction; Escaping:Goal; Motion_noise:Area; Path_shape:Area; Path_shape:Path; Perception_active:Direction; Placing:Goal; Posture:Location; Self_motion:Area; 
among,2(2),,PartWhole,,24,11,being a member or members of (a larger set):,a British woman was among the 54 victims of the disaster; snakes are among the animals most feared by man.; ,"in,of,","For this sense and next, PPamong occurs 1st in sentence.",GroupIdentifier,"copula; verbs, adjs. of discrimination",plural noun denoting a group,Becoming_aware:Ground; Change_position_on_a_scale:Group; Custom:Society; Desirability:Comparison_set; Differentiation:Phenomena; Discussion:Topic; Evaluative_comparison:Comparison_set; Expertise:Protagonist; First_rank:Contrast_set; Health_response:Protagonist; Inclination:Entity; Perception_active:Ground; Perception_experience:Ground; Scrutiny:Ground; Seeking:Ground; Similarity:Entities; Statement:Speaker; Subject_stimulus:Experiencer; Verdict:Defendant; 
among,3(3),,Co-Particiants,,35,23,occurring in or shared by (some members of a group or community):,a drop in tooth decay among children; members of the government bickered among themselves.; ,in,"Some affinity with in 7(5), FramingElement.",Participators,copula; nouns and verbs denoting activities,plural noun denoting a group; plural reflexive pronouns,Awareness:Cognizer; Categorization:Category; Change_of_leadership:Selector; Chatting:Interlocutors; Collaboration:Partners; Coming_to_be:Entity; Coming_to_believe:Cognizer; Departing:Theme; Desiring:Experiencer; Discussion:Interlocutors; Emotion_directed:Experiencer; Experiencer_subj:Experiencer; Forming_relationships:Partners; Hostile_encounter:Sides; Judgment:Cognizer; Judgment_communication:Communicator; Possession:Owner; Quarreling:Arguers; Residence:Co_resident; Self_motion:Self_mover; 
among,4(4),,Co-Particiants,,0,1,"indicating a division, choice, or differentiation involving three or more participants:",the old king called the three princesses to divide his kingdom among them; the State Council would elect a temporary president from among its members.; ,between,Interchangeable with between 4(4) except that technically 3 or more must be involved.,Coparticipants,"nouns and verbs denoting division, choice, differentiation",plural noun denoting a group; plural reflexive pronouns,Judgment:Evaluee; 
,,,,,,,,,,,,,,
,,,,,,,,,,,,,,
around,1(1),,Location,,51,24,on every side of:,the palazzo is built around a courtyard; the hills around the city.; ,"round,about,","This also inherits round 7(3b) TargetOfBlow, since ODE hasn't bothered defining it for ""around.""",ThingSurrounded,physical entity (often pl) capable of surrounding or appearing on all sides of sth,physical entity located in space,Abundance:Location; Accoutrements:Body_location; Biological_area:Relative_location; Birth:Place; Body_mark:Attachment; Cause_harm:Body_part; Change_of_consistency:Place; Change_position_on_a_scale:Path; Fluidic_motion:Area; Mass_motion:Area; Observable_bodyparts:Attachment; Path_shape:Area; Perception_experience:Ground; Posture:Location; Ride_Vehicle:Path; 
around,2(1a),,Topic,,3,0,(of something abstract) having (the thing mentioned) as a focal point:,our entire culture is built around those loyalties.; ,"round,upon,",<MISSING>,AbstractionSurrounded,verbs denoting foundational relationship; often 'build' or 'base',"an abstraction; words like matter, subject, issue, etc.",Discussion:Topic; Hostile_encounter:Issue; 
around,3(2),,Location,,165,70,in or to many places throughout (a community or locality):,cycling around the village; a number of large depots around the country.; ,"about,round,throughout,",<MISSING>,PlaceSaturated,physical entities; verbs of location and movement,a physical location,Body_movement:Area; Body_movement:Path; Cause_fluidic_motion:Goal; Dispersal:Goal_area; Fluidic_motion:Goal; Fluidic_motion:Path; Hostile_encounter:Location; Light_movement:Goal; Motion_noise:Area; Motion_noise:Path; Moving_in_place:Place; Operate_vehicle:Area; Perception_active:Direction; Perception_active:Ground; Residence:Location; Ride_Vehicle:Area; Self_motion:Area; Self_motion:Place; Sound_movement:Place; Travel:Area; 
around,4(3),,Location,,43,23,following an approximately circular route:,he walked around the airfield; it can drill around corners.; ,round,<MISSING>,BasisOfRoute,physical entities; verbs of movement,physical entity capable of being encircled,Cause_impact:Impactee; Cause_to_move_in_place:Fixed_location; Cotheme:Area; Motion:Path; Natural_features:Relative_location; Operate_vehicle:Path; Roadways:Area; Roadways:Path; Travel:Path; 
around,4(3)-1,,Location,,31,0,on the other side of (a corner or obstacle),,round,Includes some figurative use: skate/skirt around sth.,ObstacleSurpassed,objects in space; verbs of movement and placement,"an obstruction; the word ""corner""",Cause_motion:Path; Change_posture:Path; Cotheme:Path; Departing:Path; Mass_motion:Path; Path_shape:Path; Sending:Path; 
around,5(4),,Location,,41,23,so as to encircle or embrace (someone or something):,he put his arm around her.; ,"round,about,",This could probably be a subsense of 1(1) which deals with existing encirclement as opposed to purposeful encirclement or encirclement resulting from movement.,ThingEncircled,objects that can encircle; verbs of movement or placement,physical entity capable of being encircled,Attaching:Goal; Body_movement:Goal; Cause_motion:Goal; Closure:Enclosed_region; Clothing:Body_location; Clothing:Wearer; Connectors:Fixed_location; Hair_configuration:Location; Manipulation:Entity; Manipulation:Locus; Moving_in_place:Fixed_location; Perception_experience:Body_part; Placing:Goal; Rope_manipulation:Location; 
,,,,,,,,,,,,,,
,,,,,,,,,,,,,,
