by,17(4),,Temporal,,0,1,indicating a deadline or the end of a particular time period:,I've got to do this report by Monday; by now Kelly needed extensive physiotherapy.; ,"at,on,+Quirk7.70,",<MISSING>,TargetTime,a temporal event,"term or formula denoting a time, or ""the time""",Surpassing:Time; 
by,18(5),,Location,,32,8,indicating location of a physical object beside a place or object:,remains were discovered by the roadside; the pram was by the dresser.; ,"beside,near,alongside,next to,close to,",<MISSING>,LocBeside,the reference object of the complement,tangible object located in space,Being_attached:Goal; Body_movement:Goal; Change_posture:Goal; Placing:Goal; Posture:Location; Residence:Location; Self_motion:Area; Social_event:Place; 
by,19(5a),,Direction,No data to make a decision. ,0,0,past and beyond:,I drove by our house.; ,past,<MISSING>,PlacePast,the reference object of the complement,tangible object located in space,
by,2(1a),,Agent,,68,30,after a passive verb:,the door was opened by my cousin Annie; damage caused by fire.; ,with,<MISSING>,AgentName,typically immediately after passive verb or past participle,straightforward passive construction; would-be subject follows 'by',Arrest:Authorities; Arson:Perpetrator; Carrying:Carrier; Cause_confinement:Agent; Cause_harm:Agent; Cause_motion:Agent; Cause_to_wake:Cause; Cotheme:Theme; Destroying:Cause; Detaining:Authorities; Duplication:Creator; Emitting:Source_emitter; Experiencer_obj:Stimulus; Kidnapping:Perpetrator; Perception_experience:Body_part; Perception_experience:Perceiver_passive; Piracy:Perpetrator; Placing:Agent; Rape:Perpetrator; Relative_time:Focal_occasion; Rewards_and_punishments:Agent; Robbery:Perpetrator; Surpassing:Profiled_item; Theft:Perpetrator; 
by,20(6),,Temporal,,0,1,indicating the period in which something happens:,this animal always hunts by night.; ,during,<MISSING>,ActivePeriod,typically predicate; little discernable pattern,mainly 'day' and 'night'. FrameNet 'Time',Cause_temperature_change:Time; 
by,21(7),,Other,,0,0,concerning; according to:,anything you do is all right by me; she had done her duty by him.; ,with,<MISSING>,PartyAccepting,typically predicate; little discernable pattern,usu. a personal pronoun; sometimes a name or title,
by,22(8),,Other,,0,0,used in mild oaths:,"it was the least he could do, by God; I swear by Almighty God.; ","on,upon,",<MISSING>,PartyInvoked,usually swear (present tense),a revered object or deity,
by,3(1b),,Agent,,216,92,after a noun denoting an action:,a clear decision by the electorate; years of hard fund-raising work by local people.; ,"of,on the part of,",<MISSING>,AgentName,noun denoting an action,perpetrator of action represented by the POA,Attempt:Agent; Attention:Perceiver; Avoiding:Agent; Awareness:Cognizer; Becoming_aware:Cognizer; Candidness:Speaker; Categorization:Cognizer; Cause_expansion:Agent; Change_of_leadership:Selector; Choosing:Cognizer; Cogitation:Cognizer; Collaboration:Partners; Coming_to_believe:Cognizer; Commerce_buy:Buyer; Commerce_pay:Buyer; Commitment:Speaker; Communicate_categorization:Speaker; Compliance:Protagonist; Contacting:Communicator; Cure:Healer; Departing:Theme; Encoding:Speaker; Finish_competition:Competitor; Firing:Employer; Judgment:Cognizer; Killing:Killer; Killing:Victim; Mental_property:Protagonist; Prevarication:Speaker; Questioning:Speaker; Removing:Agent; Request:Speaker; Rite:Leader; Scrutiny:Cognizer; Speak_on_topic:Speaker; Statement:Speaker; Telling:Speaker; 
by,4(1c),,Source,,38,15,"identifying the author of a text, idea, or work of art:",a book by Ernest Hemingway.; ,of,<MISSING>,AgentName,follows a noun representing a creation,author's or artist's name,Text:Author; Text_creation:Author; 
by,5(2),,Instrument,,69,58,indicating the means of achieving something:,malaria can be controlled by attacking the parasite; they substantiate their opinions by the use of precise textual reference; they plan to provide further working capital by means of borrowing.; ,with,<MISSING>,MeansName,follows nouns & adjectives (including part participles),very wide variety; includes all 'by which' clauses.,Arriving:Path; Attaching:Connector; Attempt:Means; Awareness:Evidence; Becoming_aware:Evidence; Becoming_aware:Ground; Being_attached:Connector; Being_attached:Handle; Cause_confinement:Cause; Cause_expansion:Cause; Cause_expansion:Means; Cause_harm:Instrument; Cause_motion:Handle; Cause_temperature_change:Cause; Cause_to_be_dry:Means; Cause_to_move_in_place:Locus; Coming_to_believe:Evidence; Commerce_pay:Means; Communicate_categorization:Criteria; Communicate_categorization:Manner; Communicate_categorization:Means; Cotheme:Handle; Cotheme:Means; Cure:Treatment; Death:Cause; Departing:Manner; Destroying:Means; Duplication:Means; Execution:Means; Experiencer_obj:Means; Getting:Means; Killing:Manner; Killing:Means; Leadership:Means; Manipulation:Locus; Manufacturing:Means; Path_shape:Means; Path_shape:Road; Smuggling:Means; Statement:Means; Suasion:Means; 
by,6(2a),,Attribute,,1,1,indicating a term to which an interpretation is to be assigned:,"what is meant by ""fair""?; ",as,<MISSING>,TermInterp,"finite verb set: passive of mean, translate","a term, often in quotes",Communicate_categorization:Category; Test_the_test:Category; 
by,7(2b),,Attribute,,1,0,indicating a name according to which a person is known:,she mostly calls me by my last name.; ,as,<MISSING>,NameUsed,"after the object of 'call,' 'mention,' or 'address'",a name or other personal identifier; the word 'name' or its synonyms,Name_bearing:Name; 
by,8(2c),,Journey,,27,10,indicating the means of transport selected for a journey:,the cost of travelling by bus; travelling by road to Aylsham.; ,"on,in,",<MISSING>,Transport,verbs denoting travel,relatively closed set: nouns denoting transport. FrameNet 'Mode_of_transportation',Arriving:Mode_of_transportation; Departing:Mode_of_transportation; Departing:Path; Escaping:Vehicle; Path_shape:Vehicle; Travel:Mode_of_transportation; Travel:Path; 
by,9(2d),,Possessor,,0,0,indicating the other parent of someone's child or children:,Richard is his son by his third wife.; ,of,<MISSING>,Parent,"typically son, daughter, child",a name or kinship term (esp. wife or husband),
,,,,,,,,,,,,,,
,,,,,,,,,,,,,,
down,1(1),,Direction,,163,67,from a higher to a lower point of (something):,up and down the stairs; tears streaming down her face.; ,,<MISSING>,ThingDescended,verbs and verbal nouns of movement,"two or three dimensional objects; ""stairs"" is common",Breathing:Path; Carrying:Path; Cause_fluidic_motion:Goal; Cause_motion:Path; Motion:Path; Placing:Goal; Placing:Path; Removing:Path; Ride_Vehicle:Path; 
down,2(1a),,Direction,,11,7,at or to the part of (a river or stream) that is nearer the sea:,a dozen miles or so down the Thames.; ,,<MISSING>,PlaceDownstream,place names; words denoting distances; verbs of motion,"rivers, streams, courses with a downward slope",Motion_noise:Path; Travel:Path; 
down,3(1b),,Direction,,158,78,moving or at a point further along the course of (something):,he lived down the street; I wandered down the road.; ,"along,up,",<MISSING>,PlaceFurtherAlong,place names; words denoting distances; verbs of motion,places with a linear dimension,Becoming_aware:Ground; Cotheme:Path; Departing:Path; Escaping:Path; Impact:Impactee; Operate_vehicle:Path; People:Descriptor; Perception_active:Direction; Perception_experience:Body_part; Roadways:Path; Self_motion:Path; 
down,4(1c),,Location,,0,0,at or to (a place):,she was tired of going down the pub every night.; ,"to,at,",This is a mainly British informal variant.,Place,verbs and verbal nouns of movement,places,
down,5(2),,Temporal,,0,0,throughout (a period of time):,astrologers down the ages.; ,"through,throughout,","This might be a clipped back version of ""down through"" which is probably more common; essentially, it's a species of ""throughout.""",PeriodSurveyed,nouns and verbs,"mainly in idioms, denoting long periods of time",
,,,,,,,,,,,,,,
,,,,,,,,,,,,,,
during,1(1),,Temporal,,40,24,throughout the course or duration of (a period of time):,the restaurant is open during the day; the period during which he grew to adulthood.; ,"in,in the course of,",<MISSING>,Timeframe,wide range of POSs. No pattern,"NPs denoting fixed periods of time, often with modifiers; ""period""",Achieving_first:Time; Behind_the_scenes:Time; Being_employed:Duration; Being_employed:Time; Birth:Time; Cause_change_of_scalar_position:Time; Cause_confinement:Time; Cause_fluidic_motion:Time; Cause_harm:Time; Cause_temperature_change:Time; Change_position_on_a_scale:Co_Variable; Change_position_on_a_scale:Duration; Chatting:Time; Collaboration:Duration; Collaboration:Time; Coming_to_be:Time; Commerce_pay:Time; Compliance:Time; Contacting:Time; Duplication:Duration; Emitting:Duration; Emitting:Time; Evading:Time; Excreting:Time; Fluidic_motion:Time; Getting:Time; Giving:Time; Hostile_encounter:Time; Ingest_substance:Time; Killing:Time; Memory:Time; Precipitation:Time; Reshaping:Time; Sleep:Time; Surpassing:Time; Text_creation:Time; Travel:Duration; Travel:Time; Waking_up:Time; 
during,2(1a),,Temporal,,41,15,at a particular point in the course of:,the stabbing took place during a row at a party.; ,in the course of,"See Quirk 9.36 concerning effect of ""all"" and ""whole"" on this sense.",EventInTime,wide range of POSs. No pattern,NPs denoting events,Attack:Time; Becoming_aware:Evidence; Cause_motion:Time; Cause_to_fragment:Time; Change_of_phase:Time; Cotheme:Event; Death:Time; Desiring:Time_of_Event; Detaining:Duration; Detaining:Time; Escaping:Time; Event:Duration; Event:Time; Experience_bodily_harm:Event; Experience_bodily_harm:Time; Filling:Time; Impact:Time; Importance:Undertaking; Moving_in_place:Time; Perception_body:Reason; Rewards_and_punishments:Time; Social_event:Time; Statement:Time; Subject_stimulus:Circumstances; Taking:Containing_event; Theft:Time; Use_firearm:Time; 
,,,,,,,,,,,,,,
,,,,,,,,,,,,,,
for,1(1),Beneficiary,Beneficiary,,27,17,in support of or in favour of (a person or policy):,troops who had fought for Napoleon; they voted for independence in a referendum.; ,in favor of,<MISSING>,Beneficiary,"nouns & verbs of persuasion, support, winning, aspiration",desired or desirable outcome,Desiring:Event; Desiring:Focal_participant; Evidence:Proposition; Finish_competition:Competitor; Judgment_communication:Evaluee; Reasoning:Content; Statement:Message; Verdict:Finding; 
for,2(2),Concomitant,ObjectOfVerb,ObjectOfVerb fits this better than inventing a new label Concomitant,95,38,"affecting, with regard to, or in respect of:",she is responsible for the efficient running of their department; the demand for money.; ,"with,of,","This sense is an omnibus; includes many uses for which 'for' is purely idiomatic. ODE includes no personal objects in examples, but I've lumped things here that include some, esp. frame ""experiencer"" (e.g., it was difficult for them)",Concomitant,a feeling or state,otherwise object of state or feeling represented by POA,Awareness:Topic; Categorization:Item; Cogitation:Topic; Coming_to_believe:Topic; Commerce:Goods; Commerce_buy:Buyer; Communicate_categorization:Item; Custom:Behavior; Custom:Domain; Desirability:Parameter; Expectation:Phenomenon; Expensiveness:Goods; Experiencer_subj:Content; Inclination:Behavior; Judgment:Cognizer; Judgment:Evaluee; Judgment:Reason; Judgment_direct_address:Addressee; Leadership:Jurisdiction; Likelihood:Event; Request:Addressee; Rewards_and_punishments:Evaluee; Rewards_and_punishments:Reason; Scrutiny:Ground; Social_interaction_evaluation:Behavior; 
for,2(2)-1,Experiencer,ObjectOfVerb,"There is something wrong with this label. It includes sentences like ""absurd for farmers toÉ"", ""sensible for X toÉ"", etc. Many of these heads show up in NOM-ADJ. So, making the same decision as the NomBank creators, I have hesitantly lumped this together with ObjectOfVerb!",96,64,on the part of,,"with,on the part of,","See treatment created to relieve omnibus aspects of sense 2, which had phrases falling out the windows.",Experiencer,a feeling or state; overwhelmingly adj.,experiencer of condition or feeling in POA,Catastrophe:Undergoer; Custom:Protagonist; Death:Protagonist; Desirability:Affected_party; Difficulty:Experiencer; Emotion_directed:Experiencer; Expensiveness:Payer; Fairness_evaluation:Affected_party; Importance:Field; Importance:Interested_party; Importance:Undertaking; Killing:Victim; Mental_property:Protagonist; Omen:Interested_party; Social_interaction_evaluation:Affected_party; Subject_stimulus:Experiencer; Subject_stimulus:Stimulus; 
for,3(3),Beneficiary,Beneficiary,,82,51,on behalf of or to the benefit of:,I got a present for you; these parents aren't speaking for everyone.; ,on behalf of,"This sense is subject to omission of ""for"" with many ditransitive verbs: ""I got a present for you"" = ""I got you a present.""",Beneficiary,"adj, noun or verb; little discernable pattern","usually a person; otherwise, sth capable of benefiting",Accoutrements:Wearer; Becoming_aware:Phenomenon; Behind_the_scenes:Distributor; Behind_the_scenes:Production; Clothing:Wearer; Commerce_buy:Recipient; Cooking_creation:Recipient; Cure:Patient; Education_teaching:Level; Education_teaching:Student; Emotion_active:Topic; Emotion_directed:Empathy_target; Emotion_directed:Stimulus; Experiencer_subj:Topic; Facial_expression:Intended_perceiver; Giving:Conditions; Giving:Recipient; Gizmo:User; Request:Topic; Revenge:Injured_Party; Revenge:Offender; Rite:Member; Social_event:Attendee; Social_event:Honoree; Social_event:Occasion; Statement:Addressee; Text:Containing_text; Text:Genre; Text:Honoree; Text_creation:Addressee; Text_creation:Honoree; Travel:Traveler; 
for,4(3a),ProfessionalAspect,ProfessionalAspect,,16,12,employed by:,she is a tutor for the Open University.; ,"with,by,",<MISSING>,Employer,noun or verb representing work or a profession,an employer or institution,Behind_the_scenes:Studio; Being_employed:Employer; Education_teaching:Institution; 
for,5(4),Purpose,Purpose,,267,114,having (the thing mentioned) as a purpose or function:,networks for the exchange of information; the necessary tools for making a picture frame.; ,to,<MISSING>,Purpose,noun or verb representing purposeful action,fulfillment of the POA,Arrest:Offense; Attaching:Goal; Attempt:Goal; Attempt_suasion:Topic; Attention:Figure; Cause_change_of_phase:Purpose; Cause_confinement:Goal; Change_event_time:Destination_event; Clothing:Use; Collaboration:Undertaking; Commitment:Message; Communication_manner:Message; Communication_noise:Message; Competition:Competition; Connectors:Connected_item; Connectors:Use; Contacting:Communication; Contacting:Reason; Containers:Use; Cure:Affliction; Desirability:Circumstances; Education_teaching:Qualification; Education_teaching:Subject; Employing:Task; Encoding:Medium; Experiencer_subj:Reason; Gesture:Message; Getting:Purpose; Giving:Purpose; Gizmo:Use; Hiring:Purpose; Hostile_encounter:Goal; Hostile_encounter:Issue; Ingest_substance:Purpose; Invention:Purpose; Kidnapping:Purpose; Manufacturing:Purpose; Perception_active:Phenomenon; Reading:Phenomenon; Request:Message; Rite:Type; Scrutiny:Phenomenon; Seeking:Sought_entity; Skill_test:Qualification; Text_creation:Purpose; Travel:Purpose; Usefulness:Purpose; 
for,6(5),Cause,Cause,,260,125,having (the thing mentioned) as a reason or cause:,Aileen is proud of her family for their support; I could dance and sing for joy.; ,because of,"I've lumped some personal objects here, when a person is the reason for sth, even though ODE only says ""thing.""",Cause,noun or verb representing purposeful action,justification of the POA,Arrest:Charges; Attempt_suasion:Content; Change_event_time:Reason; Contrition:Action; Corporal_punishment:Reason; Death:Reason; Detaining:Charges; Execution:Reason; Fining:Reason; Firing:Reason; Getting:Reason; Importance:Reason; Judgment:Role; Judgment_communication:Reason; Judgment_communication:Role; Judgment_communication:Topic; Judgment_direct_address:Reason; Killing:Reason; Memory:Reason; Revenge:Injury; Rewards_and_punishments:Means; Robbery:Reason; Subject_stimulus:Circumstances; Theft:Reason; Verdict:Charges; 
for,7(6),Location,Destination,,4,4,having (the place mentioned) as a destination:,they are leaving for London tomorrow.; ,to,"underrepresented in FrameNet, given that it's a very common sense.",Destination,verb or motion or a conveyance,a destination,Self_motion:Goal; 
for,8(7),Other,Other,,8,6,representing (the thing mentioned):,"the ""F"" is for Fascinating.; ",,<MISSING>,Referent,"representamen of the comp; often accomapnied by a copula or ""stands"" (I.e., ""x stand for y."")",referent of the POA,Encoding:Message; Name_bearing:Entity; Word_relations:Sign_2; 
for,9(8),InExchangeFor,Other,Why is 'replace x with y' missing?,9,8,in place of or in exchange for:,swap these two bottles for that one.; ,,<MISSING>,SwapGoal,"an amount, or other item in transaction",item or items in a transaction,Commerce_collect:Goods; Commerce_pay:Goods; Robbery:Goods; 
for,10(8a),Numeric/Level,Numeric/Level,,17,6,charged as (a price):,copies are available for £1.20.; ,at,<MISSING>,Price,sth money can be exchanged for,an amount of money,Commerce_buy:Money; Commerce_sell:Money; Hiring:Compensation; 
for,11(9),Comparator,Other,,22,15,in relation to the expected norm of:, she was tall for her age; warm weather for the time of year.; ,,<MISSING>,ReferentNorm,mainly adjs (but some other POSs) expressing judgment or a state,sth that can serve as a standard or basis of comparison,Desirability:Comparison_set; Mental_property:Degree; Praiseworthiness:Evaluee; Relative_time:Landmark_occasion; Social_interaction_evaluation:Degree; Subject_stimulus:Comparison_set; Sufficiency:Standard; 
for,12(10),Temporal,Temporal,,47,18,indicating the length of (a period of time):,he was jailed for 12 years; I haven't seen him for some time.; ,during,"See Quirk 9.42 concerning omission of ""for"" in duration phrases",TimePeriod,sth subject to duration,a period of time,Apply_heat:Duration; Being_employed:Duration; Cause_confinement:Time; Change_event_time:Interval; Detaining:Duration; Hostile_encounter:Manner; Leadership:Duration; Precipitation:Duration; Precipitation:Time; Predicting:Time_of_Eventuality; Process_continue:Duration; Rewards_and_punishments:Time; Sleep:Duration; Soaking:Duration; Travel:Duration; Travel:Period_of_Iterations; 
for,13(11),Distance,Numeric/Level,,0,0,indicating the extent of (a distance):,he crawled for 300 yards.; ,along,not found in FrameNet,Distance,sth admitting of extension,a distance expressed in units,
for,14(12),Other,Numeric/Level,,0,0,indicating an occasion in a series:,the camcorder failed for the third time.; ,,"not found in FrameNet; often followed by an 'in' phrase, e.g., FOR the first time IN ten years.",SeriesItem,an action or state,the formula 'the [ordinal] time',
,,,,,,,,,,,,,,
,,,,,,,,,,,,,,
from,1(1),,Source,,330,161,"indicating the point in space at which a journey, motion, or action starts:",she began to walk away from him; I leapt from my bed; he was turning the Chamberlain government away from appeasement.; ,at,"ODE includes figurative uses: ""turning them away from appeasement"", ""stagger from crisis to crisis"". ""glance from side to side""",SpaceOrigin,verbs and verbal nouns of action and motion,point in space or abstraction identified as origin,Arriving:Source; Body_movement:Path; Body_movement:Source; Carrying:Path; Carrying:Path_start; Cause_motion:Path; Cotheme:Path; Cotheme:Source; Departing:Source; Evading:Pursuer; Fluidic_motion:Source; Kidnapping:Source; Mass_motion:Source; Motion:Source; Motion_noise:Path; Motion_noise:Source; Operate_vehicle:Source; Path_shape:Path; Path_shape:Source; Perception_active:Direction; Perception_active:Phenomenon; Piracy:Place; Placing:Goal; Placing:Source; Ride_Vehicle:Path; Ride_Vehicle:Source; Self_motion:Area; Self_motion:Path; Self_motion:Source; Sending:Source; Statement:Place; Use_firearm:Depictive; Use_firearm:Source; 
from,10(7),,Separation,,237,114,indicating separation or removal:,the party was ousted from power after sixteen years.; ,out of,This overlaps with both 1(1) and 4(3); This sense codes only forcible/unwilling separation.,SeparationOrigin,verbs and verbal nouns of separation,thing with with subj. is proximate or associated,Cause_motion:Source; Change_of_leadership:Role; Departing:Theme; Escaping:Undesirable_location; Firing:Employer; Firing:Position; Firing:Task; Forming_relationships:Partner_2; Motion_directional:Source; Observable_bodyparts:Attachment; Personal_relationship:Partner_2; Quitting:Employer; Quitting:Field; Quitting:Position; Removing:Source; Separation:Part_2; Theft:Victim; 
from,10(7)-1,,StartState,,21,15,"identifying the state or condition that one has just left, usually on account of awakening or healing",,,See treatment.,FormerState,verbs and verbal nouns of recovery or other change,an abandoned or formerly experienced state (usually sleep or illness),Cause_to_wake:Place; Cause_to_wake:Sleep_state; Cure:Affliction; Recovery:Affliction; Waking_up:Sleep_state; 
from,11(8),,ObjectOfVerb,,8,3,indicating prevention:,the story of how he was saved from death.; ,,See paper in ACL-SIGSEM by Phipps (pp 47-53) for inventory of verbs,ThingPrevented,verbs and verbal nouns of prevention,participle or noun denoting thing prevented,Attempt_suasion:Content; Avoiding:Undesirable_situation; 
from,12(9),,Cause,,49,22,indicating a cause:,a child suffering from asthma.; ,"because of,on acct of,for,",<MISSING>,Cause,verbs and verbal nouns of transition,NP denoting a cause (esp. illnesses or causes thereof),Appearance:Characterization; Biological_urge:Reason; Body_mark:Cause; Body_movement:External_cause; Catastrophe:Undesirable_Event; Coming_to_be:Cause; Dead_or_alive:Cause; Death:Cause; Emotion_directed:Stimulus; Emotion_heat:Cause; Expectation:Evidence; Experiencer_subj:Content; Intoxication:Intoxicant; Location_of_light:Cause_of_shine; Moving_in_place:Cause; Perception_body:Reason; Request:Topic; Self_motion:Reason; 
from,12(9)-1,,Agent,,88,37,by or on the part of,,"by,on the part of,",See treatment.,Agent,verbs and verbal nouns of action,an agent,Arriving:Theme; Attempt:Agent; Attention:Perceiver; Breathing:Agent; Collaboration:Partner_2; Communication_response:Speaker; Emotion_directed:Experiencer; Experiencer_subj:Experiencer; Facial_expression:Possessor; Hear:Speaker; Perception_active:Perceiver_agentive; Questioning:Speaker; Reasoning:Arguer; Request:Speaker; Revenge:Avenger; Rite:Leader; Speak_on_topic:Speaker; Statement:Speaker; Telling:Speaker; 
from,13(10),,Source,A slightly strained categorization,72,37,indicating a source of knowledge or the basis for one's judgement:,"information obtained from papers, books, and presentations.; ",out of,"Could be classified as a species of sense 3, ""provenance""",KnowledgeOrigin,"verbs and verbal nouns of perception, understanding",an information source,Awareness:Evidence; Becoming_aware:Evidence; Coming_to_believe:Evidence; Memory:Experience; Predicting:Evidence; Reasoning:Support; Text:Author; 
from,14(11),,Opponent/Contrast,,16,7,indicating a distinction:,these fees are quite distinct from expenses.; ,in relation to,<MISSING>,Contrastor,verbs and adjectives noting difference or distinction,sth distinguished from the POA's referent,Becoming_aware:Ground; Differentiation:Phenomenon_2; 
from,2(1a),,Source,,9,2,indicating the distance between a particular place and another place used as a point of reference:,the ambush occurred 50 metres from a checkpoint.; ,,<MISSING>,DistanceOrigin,statement of distance or location,point in space or abstraction identified as origin of measurement,Body_mark:Attachment; Body_movement:Manner; Change_position_on_a_scale:Co_Variable; Making_faces:Manner; Self_motion:Manner; 
from,3(2),,Temporal,,7,2,"indicating the point in time at which a particular process, event, or activity starts:",the show will run from 10 a.m. to 2 p.m.; ,,<MISSING>,TimeOrigin,durational events,point in time identified as beginning or origin,Becoming_aware:Time; Being_born:Time; Change_event_time:Landmark_time; Change_position_on_a_scale:Duration; Coming_to_be:Period_of_Iterations; 
from,4(3),,Source,,294,136,indicating the source or provenance of someone or something:,I'm from Hackney; she rang him from the hotel; she demanded the keys from her husband.; ,of,<MISSING>,Provenance,wide range of nouns and verbs; no pattern,person or thing serving as source or provenance,Accoutrements:Descriptor; Being_employed:Employer; Breathing:Source; Building:Components; Change_of_leadership:Conditions; Chemical-sense_description:Source; Collaboration:Place; Coming_to_be:Components; Coming_to_believe:Content; Commerce:Seller; Commerce_buy:Seller; Commerce_sell:Seller; Contacting:Communicator; Contacting:Location_of_communicator; Duplication:Creator; Duplication:Source; Education_teaching:Institution; Emanating:Source; Emitting:Source_emitter; Emitting:Sub_source; Expectation:Phenomenon; Facial_expression:Location; Getting:Means; Getting:Source; Hair_configuration:Location; Ingestion:Source; Judgment:Cognizer; Judgment_communication:Communicator; Judgment_direct_address:Communicator; Light_movement:Emitter; Light_movement:Source; Making_faces:Location_of_expressor; People:Descriptor; People:Ethnicity; People:Origin; Perception_active:Body_part; Perception_experience:Direction; Perception_experience:Ground; Perception_experience:Means; Request:Addressee; Roadways:Source; Scrutiny:Cognizer; Sending:Sender; Text:Containing_text; Theft:Source; Travel:Source; Vehicle:Itinerary; 
from,5(3a),,Temporal,,2,1,indicating the date at which something was created:,a document dating from the thirteenth century.; ,of,<MISSING>,CreationDate,noun denoting sth with earlier provenance,NP or adverbial of time,Text:Time_of_creation; 
