from,6(4),,StartState,,45,22,indicating the starting point of a specified range on a scale:,men who ranged in age from seventeen to eighty-four.; ,,"often followed by a to PP (sense 3(1b), ""RangeTerminus""); the 'from' is sometimes deleted",RangeStart,sth admitting of divisions,term noting first in a range,Cause_change_of_scalar_position:Value_1; Cause_expansion:Initial_size; Change_position_on_a_scale:Value_1; Expansion:Initial_size; Expensiveness:Asset; Expensiveness:Rate; People:Age; Perception_body:Subregion; 
from,7(4a),,StartState,,3,0,indicating one extreme in a range of conceptual variations:,anything from geography to literature.; ,,"often followed by a to PP (sense 3(1b), ""RangeTerminus""); the 'from' is sometimes deleted",RangeStart,sth admitting of divisions,term noting first in a conceptual range,
from,8(5),,Location,,12,14,indicating the point at which an observer is placed:,you can see the island from here; the ability to see things from another's point of view.; ,,has some affinity with 2(1a) and 4(3),ObserverLocus,verbs and verbal nouns of (usually visual) perception; also fig.,NP or adverbial of location,Awareness:Paradigm; Perception_active:Location_of_perceiver; Perception_experience:Location_of_perceiver; 
from,9(6),,Attribute,,11,5,indicating the raw material out of which something is manufactured:,a paint made from a natural resin.; ,"with,of,out of,",<MISSING>,Substance,verbs of creation and manufacture,constituent substance or ingredient(s),Invention:Material; Manufacturing:Resource; 
,,,,,,,,,,,,,,
,,,,,,,,,,,,,,
in,1(1),Location,Location,,519,249,expressing the situation of something that is or appears to be enclosed or surrounded by something else:,I'm living in London; dressed in their Sunday best; she saw the bus in the rear-view mirror.; ,inside,<MISSING>,ThingEnclosed,"verbs, participles, nouns: no pattern","sth capable of surrounding, enclosing, or framing",Abundance:Theme; Adorning:Theme; Amalgamation:Place; Apply_heat:Container; Apply_heat:Heating_Instrument; Apply_heat:Medium; Arrest:Place; Arson:Place; Avoiding:Place; Behind_the_scenes:Place; Behind_the_scenes:Production; Being_attached:Goal; Being_born:Place; Being_employed:Place_of_employment; Being_wet:Liquid; Biological_area:Relative_location; Biological_urge:Expressor; Body_movement:Area; Breathing:Place; Businesses:Descriptor; Businesses:Place; Carrying:Constant_location; Cause_change_of_consistency:Change_agent; Cause_change_of_consistency:Place; Cause_change_of_phase:Container; Cause_temperature_change:Container; Cause_temperature_change:Depictive; Cause_temperature_change:Instrument; Cause_temperature_change:Place; Cause_to_be_dry:Instrument; Cause_to_be_wet:Liquid; Certainty:Expressor; Clothing_parts:Clothing; Collaboration:Place; Coming_to_be:Place; Congregating:Place; Connectors:Fixed_location; Contacting:Address; Containers:Relative_location; Contrition:Expressor; Cotheme:Mode_of_Transportation; Custom:Place; Custom:Society; Death:Place; Departing:Mode_of_transportation; Desiring:Experiencer; Desiring:Place; Detaining:Holding_Location; Detaining:Place; Duplication:Goal; Emitting:Area; Emotion_directed:Experiencer; Emotion_directed:Expressor; Emotion_heat:Location; Escaping:Vehicle; Event:Place; Evidence:Support; Expectation:Phenomenon; Expensiveness:Origin; Experience_bodily_harm:Place; Experiencer_subj:Expressor; Filling:Theme; Fluidic_motion:Area; Fluidic_motion:Goal; Getting:Place; Grinding:Locus; Grooming:Place; Impact:Place; Ingest_substance:Place; Ingestion:Place; Judgment:Expressor; Judgment_communication:Expressor; Judgment_communication:Place; Kidnapping:Place; Killing:Place; Location_of_light:Ground; Manipulation:Bodypart_of_agent; Manipulation:Locus; Manufacturing:Place; Motion:Area; Motion:Place; Motion_directional:Area; Motion_noise:Goal; Moving_in_place:Fixed_location; Moving_in_place:Place; Natural_features:Container_possessor; Natural_features:Relative_location; Observable_bodyparts:Attachment; Operate_vehicle:Area; Operate_vehicle:Vehicle; Path_shape:Area; Path_shape:Goal; People:Descriptor; People:Origin; Perception_active:Ground; Perception_active:Means; Perception_body:Body_part; Perception_experience:Body_part; Perception_experience:Depictive; Perception_experience:Location_of_perceiver; Piracy:Place; Posture:Location; Precipitation:Place; Preserving:Medium; Prison:Location; Process_end:Place; Process_start:Place; Rape:Place; Reshaping:Locus; Residence:Location; Rite:Organization; Rite:Place; Roadways:Area; Robbery:Place; Self_motion:Area; Self_motion:Cotheme; Self_motion:Place; Sleep:Place; Smuggling:Means; Smuggling:Place; Soaking:Container; Soaking:Medium; Social_event:Place; Speak_on_topic:Place; Strictness:Area; Text_creation:Place; Topic:Text; Travel:Area; Travel:Mode_of_transportation; Travel:Place; Verdict:Place; Waking_up:Place; Weather:Place; 
in,1(1)-1,Garment,Attribute,,25,8,used to introduce someone's clothing,,,See treatment.,Garment,verbs of attirement; nouns denoting persons; adjs denoting judgments,something worn (mainly clothing),Cause_motion:Depictive; Clothing_status:Clothing; Desirability:Depictive; Experiencer_subj:Circumstance; Mental_property:Behavior; Self_motion:Depictive; Social_interaction_evaluation:Topic; 
in,2(1a),Location,Destination,"This is a sense that combines both 'we have combined them in a shampoo' and 'arrive in New York'. While it is not necessarily a spatial sense, that is the closest single meaning that can be assigned.",169,82,expressing motion with the result that something ends up within or surrounded by something else:,don't put coal in the bath; he got in his car and drove off.; ,"into,inside,",<MISSING>,ThingEntered,verbs and verbal nouns of inward or penetrative motion,sth capable of being entered or of incorating or enveloping input,Amalgamation:Whole; Arriving:Goal; Attaching:Goal; Body_movement:Goal; Breathing:Goal; Cause_confinement:Goal; Cause_fluidic_motion:Goal; Cause_harm:Body_part; Cause_motion:Goal; Cause_to_amalgamate:Whole; Change_posture:Goal; Change_posture:Location; Dispersal:Goal_area; Emitting:Means; Emitting:Sub_source; Excreting:Goal; Impact:Subregion; Motion:Goal; Perception_active:Phenomenon; Placing:Area; Placing:Depictive; Placing:Goal; Removing:Goal; Self_motion:Goal; Self_motion:Manner; Smuggling:Goal; Telling:Addressee; Travel:Goal; 
in,3(2),Temporal,Temporal,,66,32,expressing a period of time during which an event happens or a situation remains the case:,they met in 1885; at one o'clock in the morning; I hadn't seen him in years.; ,during,<MISSING>,Timeframe,an event or situation placeable in time,"a period ""longer or shorter than a day"" (Quirk)",Amalgamation:Time; Avoiding:Time; Birth:Time; Cause_harm:Time; Cause_to_amalgamate:Time; Cause_to_be_dry:Duration; Cause_to_be_dry:Time; Cause_to_wake:Time; Choosing:Time; Coming_to_be:Duration; Contacting:Time; Death:Time; Desiring:Time; Destroying:Time; Emitting:Time; Evading:Time; Event:Time; Fluidic_motion:Time; Getting:Time; Grooming:Time; Kidnapping:Time; Killing:Time; Leadership:Time; Manufacturing:Time; Mass_motion:Time; Piracy:Time; Placing:Time; Posture:Time; Precipitation:Time; Process_end:Time; Process_start:Time; Quitting:Time; Reasoning:Time; Rite:Time; Robbery:Time; Self_motion:Time; Sleep:Time; Smuggling:Time; Social_event:Time; Speak_on_topic:Time; Text:Time_of_creation; Text_creation:Time; Travel:Period_of_Iterations; Travel:Time; Verdict:Time; Waking_up:Time; Weather:Time; 
in,4(3),Temporal,Temporal,,1,1,expressing the length of time before a future event is expected to happen:,I'll see you in fifteen minutes.; ,,"in ""erasure"" occurs in some cases; see Quirk 9.35, 9.40",FutureTime,an event or situation placeable in the future,a period of time,Departing:Time; 
in,5(4),EndCondition,Manner,Attribute? Same as at 7(4),93,49,(often followed by a noun without a determiner) expressing a state or condition:,to be in love; I've got to put my affairs in order; a woman in her thirties.; ,,"many idioms: in place, in order, in love, in extremis, etc. Also included here: in PPs characterizing manner, I.e., ""nod in approval.""",Condition,nouns to which said condition applies; verbs of action that the condition accompanies,a condition (often an abstract noun with no determiner) or characterizing manner,Becoming_aware:State; Body_movement:Internal_cause; Body_movement:Manner; Cause_harm:Manner; Cause_harm:Subregion_bodypart; Cause_motion:Manner; Cause_temperature_change:Cause; Cause_to_amalgamate:Manner; Cause_to_fragment:Pieces; Cause_to_fragment:Result; Desiring:Focal_participant; Difficulty:Circumstances; Emotion_heat:Emotion; Escaping:Depictive; Fluidic_motion:Configuration; Impact:Result; Leadership:Duration; Leadership:Manner; Making_faces:Internal_cause; Motion:Manner; Motion_directional:Speed; Path_shape:Depictive; People:Age; Perception_active:Manner; Predicting:Time; Process_stop:Process; Reshaping:Result; Rope_manipulation:Knot; Self_motion:Internal_cause; Separation:Parts; Sociability:Company; Travel:Manner; 
in,6(4a),Attribute,Attribute,,131,80,indicating the quality or aspect with respect to which a judgement is made:,no discernible difference in quality.; ,"with regard to,concerning,",It is perhaps somewhat arbitrary to subsume this sense here.,Attribute,"adjectives characterizing attitudes; verbs and verbal nouns denoting change, distinction, or faculties","an attribute subject to judgment, opinion, observation; a reflexive pronoun",Candidness:Message; Candidness:Topic; Categorization:Category; Categorization:Criteria; Cause_change_of_scalar_position:Item; Cause_expansion:Item; Certainty:Content; Change_position_on_a_scale:Attribute; Change_position_on_a_scale:Co_Variable; Change_position_on_a_scale:Item; Communicate_categorization:Category; Compatibility:Parameter; Desirability:Comparison_set; Desirability:Parameter; Difficulty:Parameter; Dimension:Location; Evaluative_comparison:Attribute; Expansion:Dimension; Expansion:Item; Expertise:Knowledge; Expertise:Skill; Frugality:Behavior; Judgment:Reason; Partiality:Manifestation_of_bias; Position_on_a_scale:Variable; Praiseworthiness:Behavior; Sociability:Content; Stinginess:Resource; Strictness:Controlling_act; Strictness:Issue; Subject_stimulus:Parameter; Subject_stimulus:Property; Subject_stimulus:Stimulus; Sufficiency:Item; Sufficiency:Scale; Surpassing:Attribute; 
in,6(4a)-1,Attribute,Manner,,82,42,indicating manner or degree,,to,Classed here mainly because many other fixed phrases belong here. See treatment.,Manner_or_Degree,adjectives and verbs admitting of admitting of manner or degree,"mostly idiomatic: ""in the extreme,"" ""in more detail,"" ""in x direction"", ""in x way/fashion"" etc.",Body_movement:Path; Cause_motion:Path; Cause_to_move_in_place:Direction; Cotheme:Path; Departing:Depictive; Departing:Manner; Departing:Path; Differentiation:Manner; Duplication:Manner; Emitting:Manner; Emotion_directed:Degree; Experiencer_subj:Manner; Fluidic_motion:Path; Importance:Reason; Kidnapping:Manner; Making_faces:Manner; Mental_property:Degree; Motion:Path; Motion_directional:Manner; Moving_in_place:Direction; Operate_vehicle:Path; Path_shape:Manner; Path_shape:Path; Perception_active:Direction; Placing:Manner; Reshaping:Manner; Scrutiny:Degree; Scrutiny:Manner; Self_motion:Path; Social_interaction_evaluation:Degree; Subject_stimulus:Degree; 
in,7(5),Location,Location,This is a omnibus sense. So No real pattern emerges here,222,109,expressing inclusion or involvement:,I read it in a book; acting in a film.; ,"inside,within,among,","This sense is often a figurative use of the main literal spatial sense (sense 1). Literal: in London. Figurative: in a film. I have broadened it slightly from ODEs notion of ""inclusion or involvement.""",FramingEntity,no particular pattern; comparatives and superlatives reasonably frequent.,an abstract entity conceived figuratively in spatial terms; often an activity,Amalgamation:Manner; Amalgamation:Result; Awareness:Topic; Becoming_aware:Ground; Being_employed:Employer; Bungling:Action; Categorization:Conditions; Categorization:Item; Cause_to_be_dry:Means; Certainty:Topic; Change_of_consistency:Conditions; Change_of_leadership:Conditions; Choosing:Topic; Collaboration:Undertaking; Communicate_categorization:Medium; Communication_response:Medium; Competition:Competition; Compliance:Norm; Cotheme:Event; Custom:Domain; Death:Cause; Departing:Source; Desirability:Circumstances; Desirability:Degree; Duplication:Original; Education_teaching:Level; Emotion_directed:Stimulus; Emotion_directed:Topic; Emotion_heat:Expression; Encoding:Medium; Evidence:Domain_of_Relevance; Experience_bodily_harm:Event; Expertise:Protagonist; Finish_competition:Competition; Hear:Medium; Importance:Factor; Importance:Field; Importance:Undertaking; Invention:Material; Judgment:Evaluee; Judgment_communication:Evaluee; Leadership:Jurisdiction; Location_of_light:Cause_of_shine; Manufacturing:Manufacturer; Mental_property:Practice; Mental_property:Protagonist; Motion:Carrier; Operate_vehicle:Conditions; Part_ordered_segments:Whole; Partiality:Dispute; People:Ethnicity; Perception_experience:Ground; Performers_and_roles:Performance; Performers_and_roles:Role; Posture:Depictive; Process_end:Last_subevent; Scrutiny:Ground; Seeking:Ground; Skill_test:Examinee; Skill_test:Skill; Speak_on_topic:Topic; Statement:Medium; Statement:Speaker; Subject_stimulus:Circumstances; Text:Containing_text; Text:Topic; Text_creation:Manner; Verdict:Case; Waking_up:World_state; 
in,8(6),ProfessionalAspect,ProfessionalAspect,,20,8,indicating someone's occupation or profession:,she works in publishing.; ,at,"I've broadened this slightly to include both ""a job in publishing"" and ""a lecturer in physics."" Unifying aspect is the presence of words denoting occupation.",ProfessionAspect,copula; verbs and verbal nouns denoting occupation,categorizing word specifying sth about profession,Being_employed:Field; Businesses:Product; Education_teaching:Institution; Education_teaching:Subject; 
in,9(7),MediumOfCommunication,MediumOfCommunication,,44,17,indicating the language or medium used:,say it in French; put it in writing.; ,,"Complements containing the word ""way"" are mostly here, and are essentially ""manner"" phrases; not exactly medium, but closer to this than any other, and I am trying to avoid more sense proliferation.",Medium,verbs denoting communication (mostly of language),"a language or other medium of information, art, storage.",Accoutrements:Material; Coming_to_be:Role; Communicate_categorization:Criteria; Communicate_categorization:Manner; Dimension:Measurement; Duplication:Characterization; Emanating:Form; Encoding:Manner; Grooming:Medium; Ingest_substance:Manner; Judgment_communication:Manner; Manufacturing:Manner; Manufacturing:Resource; Statement:Manner; Telling:Medium; Text:Material; Text:Medium; 
in,9(7)-1,Garment,Attribute,"Not Garment, because the preposition gives an attribute of the garment and doesn't introduce the garment itself.",6,8,used to indicate set descriptions for clothing and other personal items,,,See treatment.,VariableQuality,"articles of clothing; ""come""; ""available""","colors, patterns, fabrics, sizes, materials",Accoutrements:Descriptor; Clothing:Descriptor; Clothing:Material; 
in,10(7a),Other,Attribute,,0,0,indicating the key in which a piece of music is written:,Mozart's Piano Concerto in E flat.; ,,<MISSING>,MusicalKey,"a musical work, or a verb or composition",a musical key,
in,11(8),Activity,Activity,,13,3,as an integral part of (an activity):,in planning public expenditure it is better to be prudent.; ,,PP may be expressed as a conjunct at beginning of sentence. Some affinity with sense 6(4a),Activity,an adjective describing a mental property,"an activity, often introduced by a gerund or verbal noun",Experiencer_subj:Content; Expertise:Behavior_product; Morality_evaluation:Behavior; Social_interaction_evaluation:Behavior; Stinginess:Behavior; 
in,12(9),Other,PartWhole,,0,0,expressing a value as a proportion of (a whole):,a local income tax running at six pence in the pound.; ,on,This is a British usage and doesn't appear in NOAD. US equivalent: on,WholeValue,a numerical division,a whole divisible numerically,
,,,,,,,,,,,,,,
,,,,,,,,,,,,,,
inside,1(1),,Location,,24,14,situated within the confines of (something):,a radio was playing inside the flat; Mr Jackson is waiting for you inside.; ,"within,in,","(Note that one sense in ODE is eliminated, being adverbial only)",ThingEnclosing,nouns and verbs,physical objecct with interior dimensions,Body_movement:Area; Cause_confinement:Goal; Change_of_phase:Place; Change_posture:Location; Chemical-sense_description:Source; Coming_to_be:Place; Cotheme:Goal; Eclipse:Obstruction; Emitting:Area; Excreting:Place; Fluidic_motion:Area; Impact:Place; People:Descriptor; Perception_body:Reason; Perception_experience:Ground; Posture:Location; Residence:Location; Rotting:Place; Sound_movement:Place; Travel:Area; 
inside,2(1a),,Destination,,27,20,moving so as to end up within (something):,Anatoly reached inside his shirt and brought out a map; we walked inside.; ,"within,in,into,","distinguished from main sense by requirement for motion (often of sense organs, e.g., ""see inside"")",TargetReceptacle,verbs of motion,physical objecct with interior dimensions,Becoming_aware:Ground; Being_attached:Goal; Birth:Place; Cause_motion:Goal; Departing:Goal; Dispersal:Goal_area; Motion:Place; Perception_active:Direction; Placing:Goal; Self_motion:Goal; 
inside,3(1b),,Location,Same problems as  in:7(5),15,4,"within (a person's body or mind), typically with reference to sensations of self-awareness:",she felt a stirring of life inside her; I just roll the phrases round inside my head; I was screaming inside.; ,"within,in,",<MISSING>,PartyEnclosing,verbs and nouns of sensation and experience,"personal pronoun, reflexive pronoun, possessive pronoun plus body part",Emotion_heat:Experiencer; Emotion_heat:Location; Perception_body:Body_part; Perception_experience:Body_part; Self_motion:Area; 
inside,4(1c),,Other,,1,0,"(in soccer, rugby, and other sports) closer to the centre of the field than (another player):",he went inside Graves and scored near the post.; ,,<MISSING>,PartyBordering,verbs of motion; nouns denoting sports maneuvers,a player's name or a sports field feature,Path_shape:Goal; 
inside,5(2),,Temporal,,0,0,in less than (the period of time specified):,the oven will have paid for itself inside 18 months.; ,within,<MISSING>,PeriodLimiting,nouns and verbs,a period of time,
,,,,,,,,,,,,,,
,,,,,,,,,,,,,,
into,1(1),,Destination,,168,86,expressing movement or action with the result that someone or something becomes enclosed or surrounded by something else:,cover the bowl and put it into the fridge; Sara got into her car and shut the door.; ,inside,"Includes some figurative use, since ODE doesn't otherwise accommdate it: baptize sb into the Catholic faith/born into a wealthy family.",Engulfer,verbs of motion inward; sth capable of being surrounded or enveloped.,sth that surrounds or envelops,Attaching:Goal; Being_attached:Goal; Being_born:Relatives; Body_movement:Path; Cause_confinement:Goal; Cause_fluidic_motion:Goal; Containers:Relative_location; Departing:Goal; Dispersal:Goal_area; Escaping:Undesirable_location; Fluidic_motion:Goal; Grinding:Goal; Mass_motion:Goal; Motion_directional:Goal; Placing:Goal; Removing:Goal; Rite:Organization; 
into,1(1)-1,,Temporal,,2,1,used to indicate a period of time begun while some activity continues,,,See treatment.,PeriodEntered,nouns and verbs of duration,a period of time; sth that has duration,Process_continue:Duration; Self_motion:Path; 
into,2(2),,Destination,,45,22,expressing movement or action with the result that someone or something makes physical contact with something else:,he crashed into a parked car.; ,against,<MISSING>,Impactee,verbs of motion.,a physical barrier,Body_movement:Goal; Cause_harm:Body_part; Cause_impact:Impactee; Impact:Impactee; Impact:Result; Motion:Goal; Reshaping:Resistant_surface; Slice:Food_item; Use_firearm:Goal; 
into,3(3),,Destination,This is like the preposition 'to',265,310,indicating a route by which someone or something may arrive at a particular destination:,the narrow road which led down into the village.; ,"at,toward,to,",<MISSING>,Destination,nouns denoting routes or paths; verbs of motion,a destination,Arriving:Goal; Carrying:Path_end; Cause_motion:Goal; Change_posture:Goal; Cotheme:Goal; Emanating:Goal; Emptying:Goal; Escaping:Goal; Excreting:Goal; Gesture:Message; Motion_noise:Goal; Operate_vehicle:Goal; Path_shape:Goal; Ride_Vehicle:Goal; Roadways:Goal; Self_motion:Goal; Smuggling:Goal; Suasion:Content; Text_creation:Place; Travel:Goal; 
into,4(4),,Location,,29,6,indicating the direction towards which someone or something is turned when confronting something else:,with the wind blowing into your face; sobbing into her skirt.; ,"against,toward,",This could easily be subsumed under 2(2).,Confrontee,verbs of motion.,a location in space; a physical or abstract barrier,Breathing:Goal; Light_movement:Goal; Making_faces:Intended_perceiver; Perception_active:Direction; Perception_experience:Direction; 
into,5(5),,Topic,,3,7,indicating an object of attention or interest:,a clearer insight into what is involved; an inquiry into the squad's practices.; ,"about,concerning,",<MISSING>,TargetOfInterest,"verbs and nouns of attention, analysis","sth subject to inquiry, attention, or interest",Questioning:Topic; Scrutiny:Ground; Scrutiny:Phenomenon; 
into,6(6),,EndState,,59,27,expressing a change of state:,a peaceful protest which turned into a violent confrontation; the fruit can be made into jam.; ,,"There is nearly always present in such sentences the origin of the transformation, and an implied ""from."" This sense includes many common idioms (into place/shape/oblivion).",ResultantState,"verbs denoting change and transformation, esp ""turn"" and ""change""","sth resulting from change, often the developed state of sth mentioned earlier",Amalgamation:Part_2; Amalgamation:Whole; Body_movement:Result; Cause_change_of_phase:Result; Cause_impact:Result; Cause_motion:Result; Cause_to_amalgamate:Part_2; Cause_to_amalgamate:Whole; Change_of_consistency:Result; Expansion:Result_size; Grinding:Result; Hair_configuration:Configuration; Hair_configuration:Hair; Location_of_light:Result; Path_shape:Result; Placing:Result; Reshaping:Result; Rope_manipulation:Knot; Rotting:Result; Self_motion:Result; 
into,7(7),,EndState,,33,18,expressing the result of an action:,they forced the club into a humiliating special general meeting.; ,,Little difference between this and the previous; it could be subsumed.,ResultantState,action verbs denoting change and transformation,the product of change,Categorization:Category; Categorization:Criteria; Cause_to_fragment:Pieces; Differentiation:Phenomenon_2; Experiencer_obj:Result; Manipulate_into_doing:Resulting_action; Separation:Parts; Slice:Pieces; 
into,8(8),,Numeric/Level,,0,0,expressing division:,three into twelve goes four.; ,,"The sense is narrowly defined, and doesn't include . . .",Dividend,a divisor,a number to be divided,
into,9(9),,Activity,,0,0,(of a person) taking a lively and active interest in (something):,he's into surfing and jet-skiing.; ,,"This is an informal sense, where the PP nearly always functions as a predicate adjective: ""I'm totally into birdwatching.""",Enthusiasm,copula or a person,a subject of enthusiasm,
,,,,,,,,,,,,,,
,,,,,,,,,,,,,,
like,1(1),,Manner,,32,15,having the same characteristics or qualities as; similar to:,he used to have a car like mine; they were like brothers; she looked nothing like Audrey Hepburn.; ,(akin to),"includes most ""look/seem/feel/sound/taste like"" constructions.",ThingSimilar,counterpart of the comp; copula; nouns,NP that is a model or similar to the POA or other sentence NP,Body_mark:Descriptor; Observable_bodyparts:Descriptor; Sensation:Manner; Sounds:Manner; Statement:Message; 
like,2(1a),,Manner,,202,96,in the manner of; in the same way or to the same degree as:,he was screaming like a banshee.; ,(in the manner of),<MISSING>,Model,verbs admitting of characterization via manner; mainly action verbs,NP representing a model of comparison,Abundance:Degree; Appearance:Characterization; Arriving:Manner; Body_movement:Manner; Cause_to_fragment:Manner; Change_posture:Manner; Chatting:Manner; Commerce_sell:Manner; Communication_manner:Manner; Communication_noise:Manner; Conduct:Manner; Cotheme:Manner; Death:Manner; Departing:Manner; Desiring:Manner; Destroying:Manner; Dispersal:Manner; Emanating:Manner; Emitting:Manner; Excreting:Manner; Experiencer_subj:Degree; Fluidic_motion:Configuration; Fluidic_motion:Manner; Friction:Manner; Gesture:Manner; Impact:Manner; Leadership:Manner; Light_movement:Manner; Location_of_light:Manner; Make_Noise:Manner; Make_Noise:Sound_source; Making_faces:Manner; Motion:Manner; Motion_directional:Manner; Operate_vehicle:Manner; Path_shape:Manner; Perception_body:Degree; Performers_and_roles:Manner; Posture:Manner; Request:Manner; Self_motion:Manner; Separation:Manner; Sound_movement:Manner; 
like,3(1b),,Manner,,15,6,in a way appropriate to:,students were angry at being treated like children.; ,as,<MISSING>,FunctionCompared,verbs characterizing treatment,NPs representing a model,Avoiding:Manner; Cause_harm:Manner; Cause_motion:Manner; Experiencer_subj:Manner; Manipulation:Manner; Motion_noise:Manner; Placing:Manner; Ride_Vehicle:Vehicle; Scrutiny:Manner; 
like,4(1c),,Manner,,2,1,such as one might expect from; characteristic of:,just like you to put a damper on people's enjoyment.; ,,<MISSING>,Model,copula;,personal pronouns; names of people; other nouns,Cause_impact:Manner; Perception_body:Manner; 
